menhera	あなたに愛されてるのを感じるけど、同時にあなたの愛はたくさんの人やものに注がれてるって知って劣等感や嫉妬が渦巻いて私の心はどんどん荒んで汚れていくのです。
menhera	私に利用価値ができたら大事にしてくれますか？愛してくれますか？
menhera	私だけを愛してくれないのなら殺してください。
menhera	自分で突き放しておいたくせに居なくなったら寂しくて涙が出るの。
menhera	私にはメンヘラの定義や境界線は分からないけど、あなたを想うとき心臓の奥が苦しくなるのもあなたへの愛が嵩みすぎて苦しくなるのも大切にしたい感情なんです。
menhera	あなたのためにどこまで堕ちれば良いの？
menhera	もっと私が尽くせば愛してくれるんだね。
menhera	あなたからの連絡一つで世界が変わるんです。
menhera	めりーくりすます。
menhera	幸せな人は人の幸せを願えるからそれが自分にも返ってきてもっともっと幸せになれる。だから幸せになりたければ人のことを一番に思おう、と決めたクリスマスイヴ。
menhera	彼女だから我慢しなきゃいけないことリストの中にクリスマスイヴに会えないことが入ってるのなら我慢しなきゃいけないね。八つ当たりしちゃいけないね。
menhera	今頃あなたは他の女の子にプレゼントを渡して聖なる夜を満喫しているのでしょうか？
menhera	手を繋げなくても良い。抱き締めてくれなくても良い。キスしてくれなくても良い。ただ隣に居てくれたらそれで幸せ。
menhera	あなたと目が合わせられないのでこっそりと見ていられるあなたの後ろ姿ばかり思い出すの
normal	お友達と海に遊びに来た！普段着ないような水着で恥ずかしいっ///
normal	サンタモニカに着いたけど、車酔いで気持ち悪い・・・。
normal	車酔いしちゃった・・・。
normal	旅行に行く日に寝坊しちゃった・・・。メアリーちゃん怒ってる〜。ごめんなさい！
normal	楽しみで前の日に眠れなくって、旅行の日に寝坊しちゃった！！急いで出かけないと・・・！
normal	みんなと旅行へ行くのが楽しみ！楽しみで、なかなか眠れないよ！
normal	わたし、もっと語学を勉強して、色んな人とお話してみたい！がんばろう！
normal	海外では、間違えることを気にせず、授業中にたくさん発言するよ！日本だと、発言するのにもちょっと緊張しちゃうよね。
normal	海外に行って、みんなに・・・。『痩せすぎ！大丈夫？』って言われて、沢山食べてた。日本に帰ってきたら、ただのデブになってました。
normal	日本人でも、着物を着る機会は今じゃ少ない。聞かれても、あまり詳しくないなぁ。
normal	フレンドリーな教授だと、最初の授業でファーストネームで呼んで！って言ってくれるよ！親しみやすいね！
normal	外国のお友達にスケボーを教えてもらった！上手く乗るのが難しい！
normal	暑すぎて頭がクラクラしちゃう・・・。熱中症にならないように気を付けよ！
normal	アメリカの良いところは、知らない人でも目が合えば微笑んでくれる。
normal	海外では、自己主張しないと受け入れて貰えない！ちゃんと言葉で伝えないと、わからないよ！
normal	初めてアポロシアターに来た！ここから多くのスターが生まれたんだね！
normal	ビデオ通話で日本のお母さんと話した！インターネットさえあれば、どこにいても連絡が取れて便利！
normal	最近は同性婚が認められたりして、海外の方が、同性愛に寛容だよね！色んな愛の形があって良いと思う！
normal	アメリカでは、デーティング期間と言って、恋人になる前の『お試し期間』があるみたい！この期間では、複数の男女と遊んでもOKみたい！
normal	漠然と将来について考えることがある。今勉強していることが、将来どんな役に立つんだろう。
normal	海外で日本の骨董品を見かけた。海を渡って旅をするのは、人だけじゃないんだね！
normal	夏の予定を考えるだけで、楽しい気持ちになるね！
normal	もうすぐ夏だね！水着買わなきゃ！
normal	勉強だけじゃなくて、海外に行けば、日本じゃできない体験も沢山できる。
normal	時々、自分の将来を見つめる。不安なことも多いけど、やりたいことや目標もたくさんある。今日も前を向いて歩こう。
normal	綺麗なお花を観て幸せな気持ちになるのは、万国共通なのかな。
normal	もっと世界に羽ばたきたい！
normal	お醤油持って行けば、海外でも日本の味を楽しめそう！ 
normal	留学前や留学中に不安なことがあったら、留学センターのスタッフに相談に乗ってもらおう！精神的な面でも、ある程度はサポートして貰えるよ！
normal	山は空気が綺麗で美味しい！都会では味わえない経験。
normal	まだ缶バッジ残ってるので、ぜひ貰いに来て下さいね！
normal	海外留学先で出来たお友達とも、何となくでも、コミュニケーションが取れるようになると楽しい。
normal	最近少しずつ暖かくなってきた。もう夏かなぁ〜。
normal	日本だけで生きるより、外国に出ると素敵な音楽に沢山出会える。
normal	まだまだ外国語の本は私には難しいみたい。教えられながら読んでもさっぱり・・・。
normal	外国語が理解できるようになってくると、自分の世界が広がったような気がしてくる。
normal	海外で出来たお友達に、色々教えてもらう。その場所での過ごし方だったり、流行っているもののことだったり。そんな毎日が楽しい！
normal	言語を学ぶ以外にも、海外で学ぶことは多い。
normal	海外に行くと、日本にいる以上に、毎日驚くことが沢山あります！
normal	海外でお友達ができたら、一緒に買い物に行きたい！ 
normal	外国の方に道を尋ねられたら、ちゃんと教えてあげられるようになりたい。
normal	オランダでチューリップが見たい！
normal	英語の地図が読めるようになるまで、道に迷って大変でした。
normal	今日は天気が良かったなぁ〜。
normal	海外で知ってる音楽に出会うと嬉しい！お友達も、とっても喜んでた！
normal	上手くコミュニケーションが取れないと、やっぱりつらい・・・。
normal	留学先で出来たお友達。きっとこの思い出は、日本に帰っても忘れない。
normal	悔しさをバネに頑張ろうと思った。あの日のことを、私は忘れない。
normal	イタリアに行って、素敵な街並みを観るのが夢です。
normal	今日はGW最終日！皆さんは何をして過ごしていますか？
normal	沢山の荷物と夢を詰め込んだ鞄を持って、私はまだ見ぬ地へと旅に出る。
normal	今日も暑かった・・・。
normal	不安や心配もあるけど、早く新しい発見をしてみたいという好奇心に背中を押される。
normal	海外に行ったら、自分が少し成長した気になれた。
normal	海外で知り合いが出来ると、初めて出来た友達のように嬉しい。
normal	海外海外のお金に慣れるまで、 ずっとお札しか使わず、小銭が溜まっていく。
normal	海外の食べ物に慣れるのには、少し時間がかかる。
normal	伝えようとする気持ちが大切。
normal	海外でどんな料理を食べても、やっぱり日本食が一番好き。
normal	目的を持って、始めて勉強はやる気が出る。
normal	留学先で出来た友達との別れが辛い。
normal	観光もいいけど、たまにはのんびりするのもいいな。
normal	街で猫に会うだけでも感動する。
normal	一人で海外に行ってみて、初めて両親の有り難みがわかった。
normal	オーストラリアに行って、コアラとカンガルーが見たい。
normal	最も効率良く語学を勉強する方法は、外国語しか話せない恋人を作ることだと思う。
normal	言語は手段であって、目的ではない。目的を明確にした方が、言語の勉強は捗る。
normal	外国に来て初めて、日本との文化の違いを知る。ネットやテレビだけで見ていても、分からないことは沢山あった。
normal	だんだん喋っていることが分かるようになってくると、来てよかったなって思う。
normal	将来は、海外で働いてみたい。
normal	学生の頃に日本だけで生きるか、外国に一度でも行くかでは、その後の価値観は変わると思う。
normal	どの国に行ってみたいですか？
normal	外国語を覚えようと思ったら、誰も日本語が喋れない環境に身を置くのが一番だと思う。
normal	外国語が分からなくても、ジェスチャーでだいたい通じる。
normal	外国語を学ぶという目的以外の理由でも、海外留学に行く子は多い。
normal	現地での買い物で店員さんが話しかけてくれた。私は拙い英語で、店員さんは私が聞き取りやすいように、ゆっくりめの英語で会話した。コミュニケーションって言語の堪能さよりも、お互いの話したいっていう気持ちなんだなぁと思った。
normal	留学って異世界への旅立ちみたい。
normal	留学することで、今まで知らなかった世界を知って、視野が広がると思う。
normal	知らない世界へと旅立つ不安は、いずれ自信となる。
normal	留学してみたい。でも、向こうの文化や人に馴染めるのか不安で仕方ない。
normal	海外にホームステイしたいと言った。今のあなたには無理だと言われた。私は自分を変えるために行きたかったのよ。
normal	外国人の素敵な男性と結婚するのが夢です。
normal	もし、好きになった人が外国人だったら、その人の為に外国語を覚えるでしょう？
normal	独りで外国に行くことは、怖いと思う反面、好奇心が私の背中を押す。
normal	この狭い日本じゃ、私の夢は語れない。
normal	そろそろ日本から出てみたい。
normal	海外のお友達とか、出来たら良いな。
normal	誰も知り合いのいない国に行ってみたい。
normal	外国語が話せると、世界の見え方も変わるのかしら？
